{
  "schemaVersion": 1,
  "evidenceProfile": {
    "id": "h3-2d1-image-mime-preservation",
    "version": 1,
    "scope": "seven-format-production-chain",
    "caseOrder": ["png", "jpeg", "webp", "bmp", "gif", "ico", "tiff"],
    "passthroughCaseIds": ["png", "jpeg", "webp"],
    "convertedCaseIds": ["bmp", "gif", "ico", "tiff"]
  },
  "persistenceOptions": {
    "includeModel": true,
    "includeTime": true
  },
  "cases": [
    {
      "id": "png",
      "projectionKind": "passthrough",
      "framePolicy": "single-image",
      "source": {
        "format": "PNG",
        "mime": "image/png",
        "fileName": "synthetic-png.png",
        "byteLength": 121,
        "sha256": "9262204cf402f25d538b5bad046fab58672e011150fc4991ccc7020b15d7d358",
        "frameCount": 1,
        "selectedWidth": 4,
        "selectedHeight": 4,
        "selectedFrameRgbaSha256": "a1b62c3d91c89576111f6620bf298a49c7ec05f08682adc58076e4107f8212d3"
      },
      "sourceMessage": {
        "role": "user",
        "content": [
          {"type": "text", "text": "Inspect the synthetic PNG image."},
          {"type": "image_url", "image_url": {"url": "data:image/png;base64,iVBORw0KGgoAAAANSUhEUgAAAAQAAAAECAYAAACp8Z5+AAAAQElEQVR4nGNUKLjw/8eBirsMDAwMNxpeKDNIGHjcAQl+2GDwH8RmAslccEhgMDiwAMRkYATJaDRIgLVwOHQoAwCwgxg5CUphTQAAAABJRU5ErkJggg=="}}
        ],
        "thought": "",
        "meta": {"evidenceCaseId": "png"},
        "_images": [
          {"name": "synthetic-png.png", "mime": "image/png", "base64": "iVBORw0KGgoAAAANSUhEUgAAAAQAAAAECAYAAACp8Z5+AAAAQElEQVR4nGNUKLjw/8eBirsMDAwMNxpeKDNIGHjcAQl+2GDwH8RmAslccEhgMDiwAMRkYATJaDRIgLVwOHQoAwCwgxg5CUphTQAAAABJRU5ErkJggg=="}
        ],
        "_model": "synthetic-model",
        "_time": "2030-01-02T03:04:01Z"
      },
      "expected": {
        "persistence": {
          "sourceMessageSha256": "2499b5634e2cc1207487ca7f3c37b293775c001cab4813261a32b0fbb35c00e9",
          "serializedMessageSha256": "2499b5634e2cc1207487ca7f3c37b293775c001cab4813261a32b0fbb35c00e9",
          "roundTripMessageSha256": "2499b5634e2cc1207487ca7f3c37b293775c001cab4813261a32b0fbb35c00e9",
          "originalDataUrlSha256": "e49f10d972fa8fa471621eebbc1804d9d89279032cd031a3c5a796819e50e3e0",
          "roundTripCaseId": "png",
          "roundTripMime": "image/png",
          "roundTripSourceSha256": "9262204cf402f25d538b5bad046fab58672e011150fc4991ccc7020b15d7d358",
          "imageCount": 1
        },
        "model": {
          "outputMime": "image/png",
          "bytePreserved": true,
          "outputByteSha256": "9262204cf402f25d538b5bad046fab58672e011150fc4991ccc7020b15d7d358",
          "outputDataUrlSha256": "e49f10d972fa8fa471621eebbc1804d9d89279032cd031a3c5a796819e50e3e0",
          "pngSignatureHex": null,
          "selectedWidth": 4,
          "selectedHeight": 4,
          "sourceAndOutputRgbaEqual": null,
          "semanticPixelSha256": null
        },
        "ui": {
          "renderUserImageSrcSha256": "e49f10d972fa8fa471621eebbc1804d9d89279032cd031a3c5a796819e50e3e0",
          "projectMessagesImageSrcSha256": "e49f10d972fa8fa471621eebbc1804d9d89279032cd031a3c5a796819e50e3e0",
          "renderUserHtmlSha256": "7055fad17ba6400d4368a6022437d970f5b1e037cbec821dbaab816fc22e1962",
          "projectMessagesHtmlSha256": "7055fad17ba6400d4368a6022437d970f5b1e037cbec821dbaab816fc22e1962",
          "usesOriginalDataUrl": true,
          "modelOutputUrlAbsentWhenConverted": null
        },
        "stability": {
          "modelProjectionStable": true,
          "uiProjectionStable": true,
          "sourceMessageUnchanged": true,
          "sourceImageCount": 1
        }
      }
    },
    {
      "id": "jpeg",
      "projectionKind": "passthrough",
      "framePolicy": "single-image",
      "source": {
        "format": "JPEG",
        "mime": "image/jpeg",
        "fileName": "synthetic-jpeg.jpeg",
        "byteLength": 402,
        "sha256": "e67855ca30452e19e69a1d45c510d444e088529ef158ed821a0f072faa73d3ad",
        "frameCount": 1,
        "selectedWidth": 4,
        "selectedHeight": 4,
        "selectedFrameRgbaSha256": "6456193579b58f7d80837f87710c60262d5be9ae623ee673b964b1b5b9317982"
      },
      "sourceMessage": {
        "role": "user",
        "content": [
          {"type": "text", "text": "Inspect the synthetic JPEG image."},
          {"type": "image_url", "image_url": {"url": "data:image/jpeg;base64,/9j/4AAQSkZJRgABAQAAAQABAAD/2wBDAAMCAgMCAgMDAgMDAwMDBAcFBAQEBAkGBwUHCgkLCwoJCgoMDREODAwQDAoKDhQPEBESExMTCw4UFhQSFhESExL/2wBDAQMDAwQEBAgFBQgSDAoMEhISEhISEhISEhISEhISEhISEhISEhISEhISEhISEhISEhISEhISEhISEhISEhISEhL/wAARCAAEAAQDAREAAhEBAxEB/8QAFAABAAAAAAAAAAAAAAAAAAAAB//EAB8QAAICAQQDAAAAAAAAAAAAAAIFAQQGAxIUMRETM//EABQBAQAAAAAAAAAAAAAAAAAAAAb/xAAeEQACAQUBAQEAAAAAAAAAAAABAhEDBAUGEjEhMv/aAAwDAQACEQMRAD8AJJllTdv1OPP8gx+jj7iys09NOwKrzPSW3k2Nv0sH2epPfiIiBERGGWo6jidqxNLLZakKleoFJJVT6qtA6VoA6gARMdN1UZ3YdsGwX+Cv3sbFytJSQACR4SJMESTE/fPysIFUf//Z"}}
        ],
        "thought": "",
        "meta": {"evidenceCaseId": "jpeg"},
        "_images": [
          {"name": "synthetic-jpeg.jpeg", "mime": "image/jpeg", "base64": "/9j/4AAQSkZJRgABAQAAAQABAAD/2wBDAAMCAgMCAgMDAgMDAwMDBAcFBAQEBAkGBwUHCgkLCwoJCgoMDREODAwQDAoKDhQPEBESExMTCw4UFhQSFhESExL/2wBDAQMDAwQEBAgFBQgSDAoMEhISEhISEhISEhISEhISEhISEhISEhISEhISEhISEhISEhISEhISEhISEhISEhISEhL/wAARCAAEAAQDAREAAhEBAxEB/8QAFAABAAAAAAAAAAAAAAAAAAAAB//EAB8QAAICAQQDAAAAAAAAAAAAAAIFAQQGAxIUMRETM//EABQBAQAAAAAAAAAAAAAAAAAAAAb/xAAeEQACAQUBAQEAAAAAAAAAAAABAhEDBAUGEjEhMv/aAAwDAQACEQMRAD8AJJllTdv1OPP8gx+jj7iys09NOwKrzPSW3k2Nv0sH2epPfiIiBERGGWo6jidqxNLLZakKleoFJJVT6qtA6VoA6gARMdN1UZ3YdsGwX+Cv3sbFytJSQACR4SJMESTE/fPysIFUf//Z"}
        ],
        "_model": "synthetic-model",
        "_time": "2030-01-02T03:04:02Z"
      },
      "expected": {
        "persistence": {
          "sourceMessageSha256": "d5451f2605560725d8acf67a5bc9c52396c53350c854991b4fdd1f2ec96b3e18",
          "serializedMessageSha256": "d5451f2605560725d8acf67a5bc9c52396c53350c854991b4fdd1f2ec96b3e18",
          "roundTripMessageSha256": "d5451f2605560725d8acf67a5bc9c52396c53350c854991b4fdd1f2ec96b3e18",
          "originalDataUrlSha256": "0cfc0af37ff5b2c66cc5bfad9b9b541458e7ee517c46796302f02a2869fdf86f",
          "roundTripCaseId": "jpeg",
          "roundTripMime": "image/jpeg",
          "roundTripSourceSha256": "e67855ca30452e19e69a1d45c510d444e088529ef158ed821a0f072faa73d3ad",
          "imageCount": 1
        },
        "model": {
          "outputMime": "image/jpeg",
          "bytePreserved": true,
          "outputByteSha256": "e67855ca30452e19e69a1d45c510d444e088529ef158ed821a0f072faa73d3ad",
          "outputDataUrlSha256": "0cfc0af37ff5b2c66cc5bfad9b9b541458e7ee517c46796302f02a2869fdf86f",
          "pngSignatureHex": null,
          "selectedWidth": 4,
          "selectedHeight": 4,
          "sourceAndOutputRgbaEqual": null,
          "semanticPixelSha256": null
        },
        "ui": {
          "renderUserImageSrcSha256": "0cfc0af37ff5b2c66cc5bfad9b9b541458e7ee517c46796302f02a2869fdf86f",
          "projectMessagesImageSrcSha256": "0cfc0af37ff5b2c66cc5bfad9b9b541458e7ee517c46796302f02a2869fdf86f",
          "renderUserHtmlSha256": "fe900881f462f37dd47755c35942bfeab51416c1a056e747d53f84eb8a3aa59f",
          "projectMessagesHtmlSha256": "523a61c5678f0139dd71d9806022dc309fe97ad73f670f04626c8a004e939787",
          "usesOriginalDataUrl": true,
          "modelOutputUrlAbsentWhenConverted": null
        },
        "stability": {
          "modelProjectionStable": true,
          "uiProjectionStable": true,
          "sourceMessageUnchanged": true,
          "sourceImageCount": 1
        }
      }
    },
    {
      "id": "webp",
      "projectionKind": "passthrough",
      "framePolicy": "single-image",
      "source": {
        "format": "WEBP",
        "mime": "image/webp",
        "fileName": "synthetic-webp.webp",
        "byteLength": 74,
        "sha256": "48ff9e02de480877b29ce6123c08eeb41ff9c21f91d59f9b537540fabe8b9d96",
        "frameCount": 1,
        "selectedWidth": 4,
        "selectedHeight": 4,
        "selectedFrameRgbaSha256": "a1b62c3d91c89576111f6620bf298a49c7ec05f08682adc58076e4107f8212d3"
      },
      "sourceMessage": {
        "role": "user",
        "content": [
          {"type": "text", "text": "Inspect the synthetic WebP image."},
          {"type": "image_url", "image_url": {"url": "data:image/webp;base64,UklGRkIAAABXRUJQVlA4TDUAAAAvA8AAEBcgEEjUQhtpXLFg8g4lf7IQBAKJRhhjji0QSGDyR5rl+C4xCASIC08yPImP6H9gAwA="}}
        ],
        "thought": "",
        "meta": {"evidenceCaseId": "webp"},
        "_images": [
          {"name": "synthetic-webp.webp", "mime": "image/webp", "base64": "UklGRkIAAABXRUJQVlA4TDUAAAAvA8AAEBcgEEjUQhtpXLFg8g4lf7IQBAKJRhhjji0QSGDyR5rl+C4xCASIC08yPImP6H9gAwA="}
        ],
        "_model": "synthetic-model",
        "_time": "2030-01-02T03:04:03Z"
      },
      "expected": {
        "persistence": {
          "sourceMessageSha256": "31cff8264b1a226ee9d5dced5ca8cbf0c6a377ade26c65bc413898d00362bb2d",
          "serializedMessageSha256": "31cff8264b1a226ee9d5dced5ca8cbf0c6a377ade26c65bc413898d00362bb2d",
          "roundTripMessageSha256": "31cff8264b1a226ee9d5dced5ca8cbf0c6a377ade26c65bc413898d00362bb2d",
          "originalDataUrlSha256": "a96ba00bb8592fb6379220e448b39211b5fd95f508029427b631a4fb66e1ccf6",
          "roundTripCaseId": "webp",
          "roundTripMime": "image/webp",
          "roundTripSourceSha256": "48ff9e02de480877b29ce6123c08eeb41ff9c21f91d59f9b537540fabe8b9d96",
          "imageCount": 1
        },
        "model": {
          "outputMime": "image/webp",
          "bytePreserved": true,
          "outputByteSha256": "48ff9e02de480877b29ce6123c08eeb41ff9c21f91d59f9b537540fabe8b9d96",
          "outputDataUrlSha256": "a96ba00bb8592fb6379220e448b39211b5fd95f508029427b631a4fb66e1ccf6",
          "pngSignatureHex": null,
          "selectedWidth": 4,
          "selectedHeight": 4,
          "sourceAndOutputRgbaEqual": null,